{
  "schema_version": "1.0.0",
  "id": "skill-project-conflicted",
  "project_id": "project-alpha",
  "name": "冲突待处理 Skill",
  "purpose": "保存 AI diff 与用户编辑冲突，等待用户处理。",
  "markdown_uri": "crp://default/projects/project-alpha/project-skill.md",
  "json_uri": "crp://default/projects/project-alpha/project-skill.json",
  "markdown_revision": 3,
  "json_revision": 3,
  "required_context": [
    {
      "context_id": "ctx-series-alpha",
      "kind": "series_memory",
      "object_id": "series-memory-alpha",
      "uri": "crp://default/memory/series/series-memory-alpha.json",
      "reason": "作为冲突处理依据。",
      "stale": false
    }
  ],
  "output_rules": [
    {
      "rule_id": "rule-user-structure",
      "origin": "user",
      "rule": "保留用户手动确认的输出结构。",
      "priority": "must",
      "source_refs": [],
      "locked_by_user": true
    }
  ],
  "style_preferences": {
    "voice": "直接、具体、可执行",
    "format_defaults": ["Markdown"]
  },
  "update_rules": {
    "patch_strategy": "rewrite_requires_confirmation",
    "user_edit_policy": "conflict_required",
    "allowed_auto_updates": []
  },
  "source_refs": [
    {
      "source_id": "source-text-001",
      "locator": "char:0-80"
    }
  ],
  "evidence_refs": [
    {
      "source_id": "source-text-001",
      "locator": "char:0-80"
    }
  ],
  "decision_log": [
    {
      "decision_id": "decision-skill-conflict-r3",
      "reason": "AI diff 触碰用户锁定规则，需要人工处理。",
      "actor": "system",
      "created_at": "2026-06-29T14:30:00+08:00"
    }
  ],
  "conflict": {
    "status": "detected",
    "conflict_refs": ["rule-user-structure"],
    "resolution": null
  },
  "revision": 3,
  "status": "conflicted",
  "trust_status": "system_generated",
  "created_at": "2026-06-29T14:00:00+08:00",
  "updated_at": "2026-06-29T14:30:00+08:00"
}
